{
  "schemaVersion": 1,
  "artifactKind": "tint_compiler_frontier_bundle",
  "requiredTargets": [
    "spirv"
  ],
  "status": "pass",
  "claimabilityStatus": "blocked",
  "compilerEvidenceReports": [
    {
      "path": "examples/tint-compiler-evidence.browser-corpus.spirv.sample.json",
      "sha256": "7f2e83611a2669d22f38ec2001e9527764e6bbc7d91bfbcbb845f4b904184026",
      "diagnosticGateStatus": "pass",
      "comparisonStatus": "comparable",
      "claimStatus": "diagnostic",
      "rowCount": 1,
      "comparableRows": 1,
      "claimableRows": 0,
      "claimBlockerCount": 5,
      "claimBlockerSummary": [
        {
          "code": "claimable_tint_compiler_evidence_report",
          "message": "tint: missing integer phase timing: parse",
          "count": 1
        },
        {
          "code": "claimable_tint_compiler_evidence_report",
          "message": "tint: missing integer phase timing: sema",
          "count": 1
        },
        {
          "code": "claimable_tint_compiler_evidence_report",
          "message": "tint: missing integer phase timing: lower",
          "count": 1
        },
        {
          "code": "claimable_tint_compiler_evidence_report",
          "message": "tint: missing integer phase timing: emit",
          "count": 1
        },
        {
          "code": "claimable_tint_compiler_evidence_report",
          "message": "compiler evidence must be claimable before it can support a Tint replacement claim",
          "count": 1
        }
      ]
    },
    {
      "path": "examples/tint-compiler-evidence.benchmark-corpus.spirv.sample.json",
      "sha256": "ab1f734b5501c6a9d8fbfbd541fe804c60f18accb3d2ac36abd49de13e7ca41b",
      "diagnosticGateStatus": "pass",
      "comparisonStatus": "comparable",
      "claimStatus": "diagnostic",
      "rowCount": 14,
      "comparableRows": 14,
      "claimableRows": 0,
      "claimBlockerCount": 57,
      "claimBlockerSummary": [
        {
          "code": "claimable_tint_compiler_evidence_report",
          "message": "tint: missing integer phase timing: parse",
          "count": 14
        },
        {
          "code": "claimable_tint_compiler_evidence_report",
          "message": "tint: missing integer phase timing: sema",
          "count": 14
        },
        {
          "code": "claimable_tint_compiler_evidence_report",
          "message": "tint: missing integer phase timing: lower",
          "count": 14
        },
        {
          "code": "claimable_tint_compiler_evidence_report",
          "message": "tint: missing integer phase timing: emit",
          "count": 14
        },
        {
          "code": "claimable_tint_compiler_evidence_report",
          "message": "compiler evidence must be claimable before it can support a Tint replacement claim",
          "count": 1
        }
      ]
    }
  ],
  "componentReceipts": {
    "loweringLinks": [
      {
        "path": "examples/wgsl-lowering-link-receipt.browser-corpus.spirv.sample.json",
        "sha256": "39c1cc3603c82af8fbeaecb9364f6251a3bba746e2b509e17459366bb4163200",
        "evidencePath": "examples/tint-compiler-evidence.browser-corpus.spirv.sample.json",
        "evidencePaths": [
          "examples/tint-compiler-evidence.browser-corpus.spirv.sample.json"
        ],
        "status": "pass",
        "targets": [
          "spirv"
        ],
        "rowCount": 1,
        "linkedRows": 1,
        "diagnosticRows": 0
      }
    ],
    "targetValidations": [
      {
        "path": "examples/tint-compiler-target-validation.frontier.spirv.sample.json",
        "sha256": "51597510a830f998602b20f6221cf3ad4dae277f1cd550dcc50fbbcfef4961ce",
        "evidencePath": "examples/tint-compiler-evidence.browser-corpus.spirv.sample.json",
        "evidencePaths": [
          "examples/tint-compiler-evidence.browser-corpus.spirv.sample.json",
          "examples/tint-compiler-evidence.benchmark-corpus.spirv.sample.json"
        ],
        "status": "pass",
        "targets": [
          "spirv"
        ],
        "summary": {
          "targetCount": 1,
          "coveredTargetCount": 1,
          "rowCount": 15,
          "validatedRows": 15,
          "diagnosticRows": 0,
          "claimBlockerCount": 0,
          "failureCount": 0
        },
        "claimBlockerSummary": [],
        "claimBlockerSummaryByEvidencePath": [
          {
            "evidencePath": "examples/tint-compiler-evidence.browser-corpus.spirv.sample.json",
            "claimBlockerSummary": []
          },
          {
            "evidencePath": "examples/tint-compiler-evidence.benchmark-corpus.spirv.sample.json",
            "claimBlockerSummary": []
          }
        ]
      }
    ],
    "phaseBenchmarks": [
      {
        "path": "examples/tint-phase-benchmark-evidence.browser-corpus.spirv.sample.json",
        "sha256": "db3cb8559a85d3dc51d29ebac80914b812c7718c48b438b0f92964aba5d6cadd",
        "evidencePath": "examples/tint-compiler-evidence.browser-corpus.spirv.sample.json",
        "evidencePaths": [
          "examples/tint-compiler-evidence.browser-corpus.spirv.sample.json"
        ],
        "status": "pass",
        "targets": [
          "spirv"
        ],
        "summary": {
          "targetCount": 1,
          "coveredTargetCount": 1,
          "rowCount": 1,
          "tintOkRows": 1,
          "phaseBenchmarkCoveredRows": 1,
          "phaseBenchmarkMissingRows": 0,
          "exactPhaseCompleteRows": 0,
          "exactPhaseMissingRows": 1,
          "notApplicableRows": 0,
          "failureCount": 0
        }
      },
      {
        "path": "examples/tint-phase-benchmark-evidence.benchmark-corpus.spirv.sample.json",
        "sha256": "256343524b1a254e9b42adfc202a1eca8211c695005df57fb0852cecab117fcd",
        "evidencePath": "examples/tint-compiler-evidence.benchmark-corpus.spirv.sample.json",
        "evidencePaths": [
          "examples/tint-compiler-evidence.benchmark-corpus.spirv.sample.json"
        ],
        "status": "pass",
        "targets": [
          "spirv"
        ],
        "summary": {
          "targetCount": 1,
          "coveredTargetCount": 1,
          "rowCount": 14,
          "tintOkRows": 14,
          "phaseBenchmarkCoveredRows": 14,
          "phaseBenchmarkMissingRows": 0,
          "exactPhaseCompleteRows": 0,
          "exactPhaseMissingRows": 14,
          "notApplicableRows": 0,
          "failureCount": 0
        }
      }
    ]
  },
  "coverageByTarget": [
    {
      "target": "spirv",
      "loweringLinkReceipts": [
        "examples/wgsl-lowering-link-receipt.browser-corpus.spirv.sample.json"
      ],
      "targetValidationReceipts": [
        "examples/tint-compiler-target-validation.frontier.spirv.sample.json"
      ],
      "phaseBenchmarkReceipts": [
        "examples/tint-phase-benchmark-evidence.browser-corpus.spirv.sample.json",
        "examples/tint-phase-benchmark-evidence.benchmark-corpus.spirv.sample.json"
      ],
      "evidencePaths": [
        "examples/tint-compiler-evidence.browser-corpus.spirv.sample.json",
        "examples/tint-compiler-evidence.benchmark-corpus.spirv.sample.json"
      ],
      "linkedRows": 1,
      "validatedRows": 15,
      "phaseBenchmarkCoveredRows": 15
    }
  ],
  "phaseTimingCoverage": {
    "requiredExactPhases": [
      "parse",
      "sema",
      "lower",
      "emit"
    ],
    "requiredBenchmarkScopes": [
      "parseWgsl",
      "validateIr",
      "generateBackend"
    ],
    "rowCount": 15,
    "doeOkRows": 15,
    "tintOkRows": 15,
    "doeExactPhaseCompleteRows": 15,
    "doeExactPhaseMissingRows": 0,
    "tintExactPhaseCompleteRows": 0,
    "tintExactPhaseMissingRows": 15,
    "tintBenchmarkScopeCoveredRows": 15,
    "tintBenchmarkScopeMissingRows": 0,
    "notApplicableRows": 0,
    "coverageByEvidencePath": [
      {
        "evidencePath": "examples/tint-compiler-evidence.browser-corpus.spirv.sample.json",
        "targets": [
          "spirv"
        ],
        "rowCount": 1,
        "doeOkRows": 1,
        "tintOkRows": 1,
        "doeExactPhaseCompleteRows": 1,
        "doeExactPhaseMissingRows": 0,
        "tintExactPhaseCompleteRows": 0,
        "tintExactPhaseMissingRows": 1,
        "tintBenchmarkScopeCoveredRows": 1,
        "tintBenchmarkScopeMissingRows": 0,
        "notApplicableRows": 0
      },
      {
        "evidencePath": "examples/tint-compiler-evidence.benchmark-corpus.spirv.sample.json",
        "targets": [
          "spirv"
        ],
        "rowCount": 14,
        "doeOkRows": 14,
        "tintOkRows": 14,
        "doeExactPhaseCompleteRows": 14,
        "doeExactPhaseMissingRows": 0,
        "tintExactPhaseCompleteRows": 0,
        "tintExactPhaseMissingRows": 14,
        "tintBenchmarkScopeCoveredRows": 14,
        "tintBenchmarkScopeMissingRows": 0,
        "notApplicableRows": 0
      }
    ]
  },
  "claimBlockers": [
    {
      "code": "claimable_tint_compiler_evidence_report",
      "path": "compilerEvidence[0].claimBlockers[0]",
      "message": "webgpu-prefix-sum:tint: missing integer phase timing: parse"
    },
    {
      "code": "claimable_tint_compiler_evidence_report",
      "path": "compilerEvidence[0].claimBlockers[1]",
      "message": "webgpu-prefix-sum:tint: missing integer phase timing: sema"
    },
    {
      "code": "claimable_tint_compiler_evidence_report",
      "path": "compilerEvidence[0].claimBlockers[2]",
      "message": "webgpu-prefix-sum:tint: missing integer phase timing: lower"
    },
    {
      "code": "claimable_tint_compiler_evidence_report",
      "path": "compilerEvidence[0].claimBlockers[3]",
      "message": "webgpu-prefix-sum:tint: missing integer phase timing: emit"
    },
    {
      "code": "claimable_tint_compiler_evidence_report",
      "path": "compilerEvidence[0].claimStatus",
      "message": "compiler evidence must be claimable before it can support a Tint replacement claim"
    },
    {
      "code": "claimable_tint_compiler_evidence_report",